IncidentDate,Time,MGRS,Latitude,Longitude,Adm2,Adm0,Explosion?,ExplosionType,Attacks?,IncidentType,GroupInitiating,Targets,IncidentCategory,Description,DeathCount,InjuredCount,CivilianInjuries?,Within5km?,Source,Adm1,ConflictOrCrimeOriented
5/22/2023,,36PXQ3452807165,8.205,34.2213,,Gambella,No,,Yes,Intercommunal Violence,Agnuak & Nuer clans,,Miscellaneous,Tribal conflict was reported between Agnuak and Nuer with unconfirmed reports of casualties.,0,Unknown,No,No,,Itang,Conflict oriented
5/21/2023,,36PWQ5811008580,8.2193,33.5276,Matar Town,Gambella,No,,Yes,Cross-border attack,Murle militants,,Crime,"On May 21st, sources reported that on May 20th, around 9 pm, Murle militants attacked the Bilkech Kebele and the Mekaneyesus Church in Matar Town in the Wantowa Woreda, Nuer Zone, Gambella Region. The incidents resulted in eight fatalities and 13 injuries.",8,13,Yes,No,,Nuer,conflict orienetd
5/21/2023,,36PXQ7542612407,8.2511,34.5927,Gambella City,Gambella,No,,Yes,Intercommunal Violence,Agnuak & Nuer clans,,Miscellaneous,"Sources reported an ongoing inter-communal conflict, allegedly between the Anuak and Nuer ethnic groups in the Itang Special Woreda. Furthermore, the conflict has spread into Gambella Town of the Anuak Zone, the capital city of Gambella Region. Currently, heavy gunfighting is occurring in Gambella town and houses are being torched in 04 Kebele of the Gambella Town.",9,17,Yes,No,,Agnuak,conflict orienetd
5/20/2023,,37PCN2463282264,11.595,37.3916,Bahir Dar,Amhara,Yes,Grenade,Yes,Crime/Killing,UAG,Unclear,Explosive/Remote Violence,"On May 20th sources reported a grenade explosion near Summerland Hotel, close to the Amhara Development Association Bureau in Bahir Dar City of the Amhara region. So far, no reports of casualties or injuries have been reported. According to reports, federal security forces have controlled the area and it is currently calm.",0,0,Yes,No,,Bahir Dar,crime oriented
5/19/2023,,36PYR2860285733,9.8156,35.08427,Mendi,Oromia,No,,Yes,Armed Clash,ENDF & OLA,Road closure & disruption movement,Crime,"On May 19th, sources reported ongoing fighting between the Ethiopian National Defense Forces (ENDF) and the Oromo Liberation Army (OLA) in theKiltu Jalelocality approximately seven kilometers from Mendi town in the West Wollega Zone in the Oromia Region. The fight led to the closure of the Gimbi Assosa B40 road, causing disruption to vehicular movement, and an interruption to transportation services",0,0,No,No,,West Wollega,conflict orienetd
5/18/2023,,37PFM9526163616,10.5214,40.7843,,Afar,No,,Yes,Intercommunal Violence,Afar & Issa clans,,Miscellaneous,"On May 18th, sources reported an ongoing interclan conflict between the Afar and Issa communities on the outskirts of the Ada-ado Kebele in theYangudi Rasa Woredaof the Mahi Rasu Zone (Zone 6). The conflict erupted at approximately 4 pm yesterday and risks potential escalation into neighboring woredas and zones.",0,0,No,No,,Zone 6,conflict orienetd
5/18/2023,,37PEM9892106874,10.012,39.9026,Shewa Robit City,Amhara,No,,Yes,Armed Clash,ENDF & UAG,,Crime,"On May 18th, sources reported an escalation in the ongoing conflict between the Ethiopian National Defense Forces (ENDF) and armed groups from the Amhara region nearShewa Robit town, Rasa Kebele, andYifatareas located in the North Shewa Zone. Currently, the road linking Addis Ababa to Dessie has been reopened; however, transportation services and vehicular movement have experienced a substantial reduction.",0,0,No,No,,North Shewa,conflict orienetd
5/4/2023,,37PCN2741782924,11.6011,37.4171,Bahir Dar,Amhara,Yes,Grenade,Yes,Crime/Killing,Unidentified,Cafteria & Street,Explosive/Remote Violence,"Today, reports indicate that two bomb explosions (grenade attacks) occurred in Bahir Dar city, Amhara Region, specifically in Kebele 14 and 04. One explosion took place in a cafeteria, while the other occurred on a road around Abay Mado. The exact number of individuals affected is currently unclear. Furthermore, the road connecting Bahir Dar to Gondar has been obstructed today",0,0,No,No,,West Gojam,crime oriented
5/3/2023,,37PEK1292850830,8.6018,39.1175,Mojo,Oromia,No,,Yes,Armed Clash,UAG,Individuals,Crime,Attack reported by sources in Mojo at 11:30 PM killing a guard. NFI,1,0,No,No,,East Shewa,crime orienetd
4/27/2023,,37PEM7135640245,10.31439,39.65171,Mehal Meda,Amhara,No,,Yes,Crime/Killing,UAG,Amhara PP chairperson,Crime,"The Amhara Prosperity Party Chairperson, Girma Yeshitila, was assasinated along with members of his security detail by unknown assailants while traveling from Mehal Meda to Debre Birhan.",4,0,No,No,,North Shewa,crime oriented
4/23/2023,,36NZM2403045815,5.83508,35.92579,Hana,SNNP,No,,Yes,Intercommunal Violence,UAG,District Administrator,Miscellaneous,"Eleven people were reportedly killed in the vicinity of the city of Hana after one member of the Salamago woreda administration was killed. Following the killing, individuals of the Bodi and Demi tribes began attcking each other.",11,6,Yes,No,,South Omo,crime oriented
4/23/2023,,37PCJ6387894699,8.09222,37.76458,,SNNP,No,,No,Protest,Muslim & Orthodox religon followers,Each other,Demonstration,"SNNPR police contact confirmed that there was a tension in Gunchire since yesterday evening due to dispute between Muslim and orthodox religion followers. The reason was a few months ago Muslim students were asking the school management to wear religious cloths than school uniform and the school has approved their request. Subsequently , the orthodox religion follower students were provided similar request to the school. The school management has been declined both student?s requests and has decided to permit only the school uniform in the school during the learning time. However, yesterday starting from 9pm in the evening conflict arises between these two religion followers. Police said damages on property was reported and casualty also will be expected.",0,0,No,No,SNNPR Police contact,Gurage,conflict oriented
4/17/2023,,37PCQ7158243606,13.0558,37.8156,,Amhara,No,,Yes,Armed Clash,ENDF & Amhara Special force,Unclear,Crime,A small scale clash was reported between ENDF and ASF between Debat and Debark.,0,0,No,No,,North Gondar,conflict oriented
4/16/2023,,37PGL3133225299,9.2692,41.1058,Cafebante,Oromia,No,,Yes,Armed Clash,OLA & GOE,,Crime,"Sources reported that there has been ongoing fighting between OLA militant group and ENDF since April 16th along the main road from Chiro (aka Asebe Teferi) to Dire Dawa in a place known as Cafebante Village (Guje mountain), Doba Woreda in the West Harerghe Zone (Oromia region), resulting in numerous casualties. Recent information suggests that OLA fighters have expanded to areas along the Western and Eastern Harargee Zones, including Xullo, Kare Mille, and nearby locations.",0,0,No,No,,West Hararghe,conflict oriented
4/13/2023,,37PFM0796528060,10.20335,39.9857,,Amhara,No,,Yes,Armed Clash,UAG,Amhara special force,Crime,"On April 13th, between 6:30-7pm, an unidentified armed group (UAG) ambushed two vehicles carrying Amhara Special Force (ASF) members and civilians in Gerbina Balchi Kebele, Jile Timuga Woreda, Oromo Special Zone, and Jewaha Kebele, Efrata Gidim Woreda, in the North Shewa Zone, Amhara Region. The first minibus was attacked in Jile Timuga, and after a few minutes, the second minibus was attacked in Jewaha Kebele, Efrata Gidim Woreda. An unconfirmed number of ASF members and civilians were killed (reportedly the driver escaped), and gruesome pictures of the victims are being circulated on social media, which could create anger leading to further violence or protests.",Unknown,0,No,No,,Oromo Special Zone,Crime oriented
4/13/2023,,37PFM0674417673,10.10945,39.97427,,Amhara,No,,Yes,Armed Clash,UAG,Amhara special force,Crime,"On April 13th, between 6:30-7pm, an unidentified armed group (UAG) ambushed two vehicles carrying Amhara Special Force (ASF) members and civilians in Gerbina Balchi Kebele, Jile Timuga Woreda, Oromo Special Zone, and Jewaha Kebele, Efrata Gidim Woreda, in the North Shewa Zone, Amhara Region. The first minibus was attacked in Jile Timuga, and after a few minutes, the second minibus was attacked in Jewaha Kebele, Efrata Gidim Woreda. An unconfirmed number of ASF members and civilians were killed (reportedly the driver escaped), and gruesome pictures of the victims are being circulated on social media, which could create anger leading to further violence or protests.",Unknown,0,No,No,,Oromo Special Zone,Crime oriented
4/12/2023,,37PFK0072784230,8.9028,39.91614,Metehara,Oromia,No,,Yes,Crime/Killing,OLA,Company chairman,Crime,A company chairman and his family were reportedly executed by OLA fighters,1,unknown,Yes,No,,East Shewa,Crime oriented
4/12/2023,,37PCN2307578933,11.5648,37.3775,Bahir Dar City,Amhara,No,,No,Arrests,ENDF,Journalist,Crime,"Sources reported ENDF arrested Dawit Begashaw, a journalist employed by the Arat Kilo Media Youtube Channel.",0,0,No,No,,Bahir Dar,Crime oriented
4/12/2023,,37PFK1433472932,8.8003,40.0396,,Oromia,No,,Yes,Crime/Killing,OLA,Kebele Chirman & Spouse,Crime,Sources reported that OLA militants killed the chairman of Kobo Kebele and his wife.,2,0,No,No,,East Shewa,crime oriented
4/11/2023,,37PEL5718369331,9.67326,39.52125,Debre Birhan,Amhara,No,,Yes,Armed Clash,ENDF & Amhara Special force,,Crime,ENDF have reportedly been engaged in heavy fighting with ASF IVO of the Dashen Beer Factory in Debre Birhan.,0,0,No,No,,North Shewa,Conflict oriented
4/11/2023,,38PKQ0157300185,8.13468,42.29201,Fiq Town,Somali,No,,No,Protest,Protesters,GOE decision,Demonstration,"Sources reported that a protest is taking place in Fiq town, Erer zone, Somalia Region, against the decision to reorganize the Regional Special Forces. Reportedly there is large number of protestors and roads in the city are closed",0,0,No,No,,Nogob,Unknown
4/11/2023,,37PEN8009924934,11.0801,39.7334,Kombolcha,Amhara,No,,No,Protest,Protesters,Opposing GOE plan,Demonstration,Sources reported that protests following the restructuring of regional special forces in Kombolcha resulted in two deaths and more than twelve injuries,2,12,Yes,No,,South Wollo,Unknown
4/10/2023,,37PFM0560444593,10.352924,39.9646,Ataye Town,Amhara,No,,Yes,Armed Clash,OLA,,Crime,"Sources reported that the OLA militant group has alegedly mobilized some of its members from nearby areas in the Oromia Region to the North Shewa Zone of the Amhara Region. According to reports, the OLA has launched attacks from a village around 25km from Ataye Town, utilizing heavy weapons. This has caused a panic and fear amongst Ataye residents since yesterday as the fighting is near to Ataye. Due to the unrest near Ataye, nearby residents in Shewa Robit and surrounding areas are likely to have rising fears of potential impending insecurity. Additionally, there are reports of protests taking place today, in Ataye Town and/or near it in Senbete, against the reorganization/disarmament of Amhara Special Forces.",0,0,No,No,,North Shewa,Conflict oriented
4/10/2023,,37PFM0900140214,10.31323,39.9955,Senbete,Amhara,No,,No,Protest,GOE,Amhara special force,Demonstration,Protests reported against the disarming of ASF.,0,0,No,No,,Oromia,Unknown
4/10/2023,,37PEP6776143052,12.1485,39.6228,Kobo,Amhara,No,,Yes,Crime/Killing,UAG,Catholic Relief employee,Crime,Catholic Relief Services announced the killing of a security officer and a driver by unknown parties while driving from Mekelle to Kombolcha.,2,0,No,No,,North Wollo,Crime orienetd
4/10/2023,,37PEK9182391031,8.9645,39.8353,,Oromia,No,,Yes,Armed Clash,OLA & GOE,,Crime,Armed clashes reported between the OLA and GOE forces in the Haroo Kerensa Kebele,0,0,No,No,,East Shewa,conflict oriented
4/9/2023,,37PCN2346778585,11.56168045,37.38110964,Bahir Dar City,Amhara,Yes,Bomb,Yes,Crime/Killing,UAG,local Grocery,Explosive/Remote Violence,"Sources reported a bombing that resulted in three fatalities and 17 injuries at Mimi Grocery, located near Abay Mado, towards the Diaspora area in Bahir Dar in the Amhara Region. The incident occurred last night at around 7:30 pm. According to sources, a group of unknown assailants threw a hand grenade in the middle of the crowd who were inside the bar",3,17,No,No,,Bahir Dar,Crime oriented
4/9/2023,,37PCP3254593971,12.60523,37.458379,,Amhara,No,,No,Protest,Protesters,GOE,Demonstration,Demonstrations ongoing in Gondar opposing federal government plan to disband regional special forces. Reports of gunfire across town.,0,0,No,No,,Gondar City,Unknown
4/9/2023,,37PEP6856943328,12.150982,39.63023,Kobo,Amhara,No,,Yes,Armed Clash,ENDF & FANO,,Crime,Gunfire reported between ENDF and FANO members in the area. Civil Unrest and demonstrations reported in Kobo Town by youth groups.,0,0,No,No,,North Wollo,Conflict oriented
4/9/2023,,37PCM6141043068,10.33809,37.73421,Debre Markos,Amhara,No,,No,Protest,Unclear,Road closure,Demonstration,Demonstrations and road blocks continue in Debre Markos Town. UN staff reportedly stranded.,0,0,No,No,,East Gojam,Unknown
4/9/2023,,37PDM0621924064,10.16758,38.14389,Dejen Town,Amhara,No,,No,Protest,Youth group,Road closure,Demonstration,All transport from Addis Ababa to Debre Markos and Bahir Dar were suspended after youth groups blocked A3 highway at Dejen Town. Travelers have been stranded for last 3 days.,0,0,No,No,,East Gojam,Unknown
4/9/2023,,37PEM9993906523,10.0088,39.91188,Shewa Robit City,Amhara,No,,No,Protest,Unclear,Unclear,Demonstration,Demonstrations reported in Shewa Robit and Debre Birhan,0,0,No,No,,North Shewa,Unknown
4/9/2023,,37PCQ6561035080,12.97846,37.76091,Dabat,Amhara,No,,No,Protest,Unclear,Road closure,Demonstration,Demonstrations and road blocks reported in Dabat.,0,0,No,No,,North Gondar,Unknown
4/9/2023,,37PEP0489830103,12.0321,39.045,Lalibela,Amhara,No,,No,Protest,Unclear,Road closure,Demonstration,Demonstrations and road blocks reported in Lalibela,0,0,No,No,,North Wollo,Unknown
4/9/2023,,37PCP5817218723,11.92618,37.6976,Woreta,Amhara,No,,No,Protest,Unclear,Road closure,Demonstration,Demonstration and road blocks reported at Woreta Town on the A3 highway connecting Bahir Dar to Gondar and Debre Tabor.,0,0,No,No,,South Gondar,Unknown
4/9/2023,,37PCP5817218723,11.92618,37.6976,Woreta,Amhara,No,,Yes,Armed Clash,ENDF & Youth group,Unclear,Crime,A clash between ENDF and youth groups was reported IVO Woreta Town with unknown number of casualties.,0,0,No,No,,South Gondar,Conflict oriented
4/9/2023,,37PCM3560868550,10.56747,37.4975,Dembecha Town,Amhara,No,,No,Protest,Unclear,Unclear,Demonstration,"Demonstrations reported at different districts in West Gojam, including Dembecha, Achefer Giga, and Merawi",0,0,No,No,,West Gojam,Unknown
4/9/2023,,37PCK6488216245,8.2871,37.7731,Welkite,Oromia,No,,No,Protest,Protesters,Opposing GOE plan,Demonstration,Sources reported a fifth sit-at-home strike in the Gurage Zone following the regionalization question.,0,0,No,No,,Gurage,Unknown
4/6/2023,,37NDD8213095129,3.5748,38.8391,Mudi Ambo,Oromia,No,,Yes,Armed Clash,OLA,ENDF,Crime,Sources reported that the OLA attacked ENDF troops in Mudi Ambo Village,0,0,No,No,,Borena,Conflict oriented
4/6/2023,,37PBL3109105256,9.0859,36.5536,Nekemte,Oromia,No,,No,Arrests,Police,Mayor & other officials,Crime,Sources reported the mayor of Nekemte and other officials were detained by police in connection with the murder of a Prosperity Party senior leader.,0,0,No,No,,East Wellega,crime oriented
4/5/2023,,37PEK7337972145,8.79402,39.66722,,Oromia,No,,No,Kidnapping,OLA,Passangers,Crime,Sources reported that OLA stopped vehicles on the highway between Welenchiti and Metahara and abducted passengers to an unknown location.,0,0,No,No,,East Shewa,Crime orinted
4/5/2023,,37PDK6578697996,9.02831,38.6887,Addis Ababa,Addis Ababa,No,,No,Protest,Residents,GOE forces,Demonstration,Residents clashed with security forces due to demolition endeavors in Kofe Keraniyo Sub-City,0,0,No,No,,Kolfe Keranyo,Conflict oriented
4/4/2023,,37PDK6813991279,8.96757,38.71016,Addis Ababa,Addis Ababa,No,,No,Arrests,Joint Security & Intelligence Task force,Member of covert group,Crime,"The Joint Security and Intelligence Task Force reported that it arrested several members of a covert group allegedly planning to instigate a nationwide conflict by assassinating senior government officials in Addis Ababa, Bahir Dar, Adama, and Dire Dawa.",0,0,No,No,,Addis Ababa,Crime orineted
4/3/2023,,37PBK1564462120,8.69516,36.4159,Arjo,Oromia,No,,Yes,Armed Clash,UAG & GOE forces,Unclear,Crime,An armed clash took place between a UAG and security forces IVO the Arjo Sugar Factory outside of Arjo. Two were reportedly killed and unknown number injured.,2,unknown,Yes,No,,East Wellega,Conflict oriented
4/3/2023,,37PEK4465988757,8.94465,39.40625,Arerti,Amhara,No,,No,Protest,Unidentified,Amhara Adminstration,Demonstration,A demonstration was held denouncing the current administration,0,0,No,No,,North Shewa,Unknown
4/3/2023,,37PDP7304027186,12.00561,38.75234,Meket,Amhara,No,,No,Protest,Unidentified,Amhara Adminstration,Demonstration,A demonstration was held denouncing the current administration,0,0,No,No,,North Wollo,Unknown
4/3/2023,,37PCM3539268551,10.56747,37.49552,Dembecha Town,Amhara,No,,No,Protest,Unidentified,Amhara Adminstration,Demonstration,A demonstration was held denouncing the current administration,0,0,No,No,,West Gojam,Unknown
4/3/2023,,37PCM2231580943,10.67891,37.37544,Jiga,Amhara,No,,No,Protest,Unidentified,Amhara Adminstration,Demonstration,A demonstration was held denouncing the current administration,0,0,No,No,,West Gojam,Unknown
4/3/2023,,37PEN6790376779,11.5492,39.62275,Wurgesa,Amhara,No,,No,Protest,Unidentified,Amhara Adminstration,Demonstration,A demonstration was held denouncing the current administration,0,0,No,No,,North Wollo,Unknown
4/3/2023,,37PBN9855163117,11.4205,37.1536,Merawi,Amhara,No,,No,Protest,Unidentified,Amhara Adminstration,Demonstration,A demonstration was held denouncing the current administration,0,0,No,No,,West Gojam,Unknown
4/1/2023,,37PEK9085489362,8.94942,39.82645,Illala,Oromia,No,,Yes,Armed Clash,UAG,Unclear,Crime,An armed clash was reported IVO Illala in Fentale Woreda. No further details known.,0,0,No,No,,East Shewa,Conflictoriented
3/31/2023,,37PFM8153021999,10.14584,40.65689,Gewane,Afar,No,,Yes,Intercommunal Violence,Afar & Issa clans,,Miscellaneous,"Sources reported new clashes between Afar and Issa (Somali) clans in the Korkoro Kebele of the Gewane Woreda and the Hanruka Woreda in Zone 3 (Gabi Rasu) and the Abida, Sybaibe, Kilelu, and Simurobi Gele'alo Woredas in Zone 5 (Mahi Rasu).",0,0,No,No,,Zone 3,Conflict oriented
3/30/2023,,37PDM6124818828,10.121154,38.64628,,Oromia,No,,Yes,Armed Clash,OLA,Residents,Crime,"On March 30th, sources reported that the OLA militant group has been attacking and burning residents' houses starting March 25th. Additionally, there are reports circulating that the militant group has kidnapped over 100 civilians for ransom in Harbu Dire, Hamuma Gendo, and Babu Dire kebeles in the Dera Woreda of the North Shewa Zone (Oromia Region). The militant group carried out similar attacks a few months ago in the Babu Dire Kebele, resulting in several fatalities and destruction of residents? properties.",Several,0,No,No,,North Shewa,Crime oriented
3/30/2023,,37PBL3091505333,9.086588,36.55199,Nekemte,Oromia,No,,Yes,Crime/Killing,UAG,Ruling party Senior official,Crime,"A senior official of the ruling Prosperity Party was killed by unknown gunmen in Nekemte, the capital of East Welega Zone in West Oromia. Ato Desalen Bokonja, the head of Nekemte City Prosperity Party office, was killed on Thursday march 30,2023 by unidentified armed men (allegedly OLF Shene)while he was leaving his residence for work",1,0,No,No,,East Wellega,Crime oriented
3/29/2023,,37PGM3746105712,9.99566,41.16619,,Somali,No,,Yes,Intercommunal Violence,,,Miscellaneous,Clashes eruprted between Somali and Afar ethnic groups.,0,0,No,No,,Sitti,Conflict oriented
3/27/2023,,38PKS3428089889,10.75453,42.57032,Aysha,Somali,No,,Yes,Protest,ENDF,Protesters,Demonstration,"At least 3 Somalis reportedly killed by ENDF while protesting in the town of Aysha. The protestors were blocking traffic along the road from Djibouti by protesting against ENDF support for Afari police targeting and displacing Somalis from their homes in Adeytu, Garba Issa, and Undufo for the last 5 years.",3,0,No,No,,Sitti,Unknown
3/26/2023,,38PKT4131518754,11.01586,42.63255032,Dewele,Somali,No,,Yes,Protest,Issa Somali Clan,Road closure,Demonstration,Sources the reported that the road connecting Dire Dawa and Djibouti was closed around Dewelle (Somali Region) due to a protest by the Issa Somali clan questioning ENDF's impartiality in the Afar-Issa conflict. There are unconfirmed reports of clashes between protesters and ENDF forces trying to reopen the road.,0,0,No,No,,Sitti,Conflict orinted
3/22/2023,,37PCP6026839797,12.1168,37.71594,,Amhara,No,,Yes,Crime/Killing,UAG,USAID implementing partner employee,Crime,Employee of a USAID implementing partner was murdered by unknown persons while returning home from work. Motives unknown at the the time of this report,1,0,No,No,,Southern Gondar,Unknown
3/21/2023,,36PXQ3897308175,8.21401,34.26168,,Gambella,No,,Yes,Intercommunal Violence,Local Youth & refugees,,Miscellaneous,Sources reported a clash between local youths and refugees in Jewi Camp in the Itang Special Woreda,0,0,No,No,,Nuer,Conflict oriented
3/21/2023,,37PBR4233480217,14.2818,36.61168,Humera,Tigray,No,,Yes,Cross-border attack,Samri group from Sudan,Cotton Stalks,Crime,"Alleged members of the Samri group from Sudan infiltrated Humera, setting fire to 2,500 quintals of cotton stalks and killing an unconfirmed number of day laborers.",Unknown,0,No,No,,Western Tigray,Crime oriented
3/18/2023,,37PEP6070574478,12.43282,39.55855,Alamata,Tigray,No,,No,Protest,Protesters,GOE,Demonstration,Protests erupted by residents calling for the GOE to recognize their ethnicity as Amharans.,0,0,No,No,,Southern Tigray,conflict oriented
3/17/2023,,37PCR5849029575,13.83238,37.69066,Mai Gaba,Tigray,No,,Yes,Armed Clash,Amhara & Tigray fighters,Militias,Crime,A clash reportedly broke out between Amhara militia and Tigray fighters resulting in at least one militia member killed.,1,0,No,No,,Western Tigray,conflict oriented
3/17/2023,,38PKR5249070426,9.67615,42.74436,,Somali,No,,Yes,Intercommunal Violence,Somali & Oromo clans,,Miscellaneous,"Clashes between the Somali, Geri, and Oromo Jarso clans continued in the Sheikmod and Sancade kebeles, Tulu Guled woreda, resulting in 13 deaths since March 15 and an unknown number of injured.",13,0,No,No,,Fafan,conflict oriented
3/17/2023,,37PEM9138787202,10.73862,39.83579,Majete,Amhara,No,,Yes,Armed Clash,OLA & Amhara farmers,,Crime,Sources reported sustained gunfire between the OLA militant group and Amhara farmers.,0,0,No,No,,North Shewa,conflict oriented
3/17/2023,,37PDK6925292763,8.981,38.72027,,Addis Ababa,No,,No,Kidnapping,UAG,Political analyst,Crime,"Unidentified armed men kidnapped Mr. Negussie Berhanu, a political analyst, from the Mekanisa area in Nefas Silk-Laphto Sub-city",0,0,No,No,,,Crime oriented
3/17/2023,,37PDK7728293881,8.99116,38.79332,,Addis Ababa,No,,No,Kidnapping,UAG,Teacher,Crime,"Unidentified armed men kidnapped Mr. Taye Bogal, history teacher and activist, from Bole Yod Abissinia area in Bole Sub-city",0,0,No,No,,,Crime oriented
3/17/2023,,36PWQ8343613096,8.25978,33.75761,,Gambella,No,,Yes,Crime/Killing,UAG,Regional security force,Crime,A member of the regional security forces was killed in the rural village of Gildak.,1,0,No,No,,Nuer,Crime oriented
3/17/2023,,37PFK0104184215,8.90266,39.919,Metehara,Oromia,No,,Yes,Crime/Killing,UAG,Individuals,Crime,UAG attacked and killed 8 individuals in Metehara Town.,8,0,No,No,,East Shewa,Crime oriented
3/16/2023,,37PBL9273456938,9.55644,37.11164,,Oromia,No,,Yes,Armed Clash,GOE & UAG,Unclear,Crime,Armed clash occurred between GOE and a UAG in the vicinity of Shambu and Kara Konte.,0,0,No,No,,Horo Gudru Wellega,conflict oriented
3/15/2023,,37PBL2421814836,9.17205,36.4905,,Oromia,No,,Yes,Armed Clash,UAG,Military Vehicles,Crime,"A UAG reportedly ambushed three military vehicles in the Wollo Sefer area of Sasiga woreda, resulting in an unknown number of casualties.",0,0,No,No,,East Wellega,conflict oriented
3/15/2023,,37PAK8364986358,8.91204,36.12369,,Oromia,No,,Yes,Armed Clash,GOE & UAG,Unclear,Crime,Armed clash occurred between GOE and a UAG in the vicinity of Chawaka. No reports of casualties,0,0,No,No,,Buno Bedele,conflict oriented
3/15/2023,,37PCL6745106960,9.10752,37.7938,Daki/Dek,Oromia,No,,Yes,Armed Clash,GOE & UAG,Unclear,Crime,Armed clash occurred between GOE and a UAG in the vicinity of Daki/Dek. Three were reportedly killed,3,0,No,No,,West Shewa,conflict oriented
3/15/2023,,37PEK7553027175,8.38725,39.68605,Arboye,Oromia,No,,Yes,Armed Clash,GOE & UAG,Civilians,Crime,Armed clash occurred between GOE and UAG in the vicinity of Arboye. At least one person was reportedly killed.,1,0,No,No,,Arsi,conflict oriented
3/14/2023,,37NDG0676160817,5.97776,38.15757,Tore Badiye,SNNP,No,,Yes,Armed Clash,GOE & UAG,Unclear,Crime,Armed clash occurred beween GOE and a UAG in the vicinity of Tore Badiye. One reportedly killed and unknown number injured,1,0,No,No,,West Guji,conflict oriented
3/14/2023,,37PEK4868636520,8.47213,39.44232,Bofa,Oromia,No,,Yes,Armed Clash,GOE & UAG,Unclear,Crime,"Armed clash occurred between GOE and UAG in the vicinity of Bofa in Boset Woreda, East Shewa.",0,0,No,No,,East Shewa,conflict oriented
3/14/2023,,38PKR7679757684,9.56236,42.96647,,Somali,No,,Yes,Intercommunal Violence,Oromo & Somali ethnic group,,Miscellaneous,"Conflict broke out between Jarso-Oromo and Geri-Somali ethnic groups, with casualties reported on both sides. Tensions are reportedly high in the area.",0,0,No,No,,Fafan,conflict oriented
